program_id,program_name,category,target_condition,description,contact_channel,disclaimer
SP-01,숲가꾸기 지원사업,숲가꾸기,고영급·고밀도 임분,간벌·가지치기 등 숲가꾸기 비용 일부 지원 검토,관할 시군 산림부서 / 산림조합,지원 대상·예산은 연도별 지자체 공고에 따라 달라질 수 있음
SP-02,조림·갱신 지원사업,조림·갱신,수확·갱신 또는 조림 필요지,조림·갱신 비용 및 묘목 지원 검토,관할 시군 산림부서,신청 가능 여부는 현장조사 후 결정됨
SP-03,사방사업,산사태 예방,산사태 위험지·급경사지,사방댐·산지사방 등 재해 예방 사업 검토,산림청·지자체 산사태 담당,재해위험 평가 결과에 따라 우선순위가 달라짐
SP-04,산불예방 숲가꾸기,산불 예방,산불 위험 높은 임분,내화수림 조성·연료물질 관리 등 산불 예방 조치 검토,관할 시군 산불방지 담당,사업 시행은 지자체 계획에 따름
SP-05,산림탄소 상쇄·관리,탄소관리,탄소흡수 잠재력 높은 임분,산림탄소 흡수량 유지·증진 프로그램 검토,한국임업진흥원 / 산림탄소센터,등록·인증 요건 충족 여부 확인 필요
SP-06,산림경영 상담,산림조합 상담,관리 필요도 높은 사유림,산림경영계획 수립 및 관리 자문 상담,지역 산림조합,상담은 가능하나 사업 적용은 별도 검토 필요
SP-07,현장조사·산림조사 지원,현장조사,접근성 낮음 또는 보호구역,현장 정밀조사 및 행정 확인 지원 검토,관할 시군 산림부서,조사 일정·비용은 사전 협의 필요
